{
  "schema_version": "2.2",
  "verified": false,
  "provenance": {
    "generated_by": "HighWater Rescue Routing Engine Person 4",
    "code_version": "2.2.1",
    "network": "curated_osm_derived_approximate",
    "coordinates_verified": false,
    "bridge_order_unverified": true,
    "risk_model": "heuristic_uncalibrated",
    "geometry_quality": "schematic_straight_lines",
    "benchmark": "synthetic",
    "population": "synthetic_demo",
    "input_files": {
      "data/zaragoza_network.json": "58600c43b091efe7bda5ec5ae641a6e85b9b509b6e6d3b75284dfdee438bdd15",
      "data/synthetic_depth_map.json": "b7dbe3427aaa8312ab811af50738b7735753c4397be4c46465a1a530666d3983",
      "data/population_zones.json": "a9447951203f58d0de3e2dac83d9c6ccfd8110c410b7ec95cbb9d2c64695bcd0"
    },
    "deterministic_seed": 42
  },
  "type": "FeatureCollection",
  "features": [
    {
      "type": "Feature",
      "geometry": {
        "type": "LineString",
        "coordinates": [
          [
            -0.8988,
            41.6347
          ],
          [
            -0.8872,
            41.6468
          ],
          [
            -0.882,
            41.653
          ],
          [
            -0.8757,
            41.6562
          ],
          [
            -0.8751,
            41.658
          ],
          [
            -0.874,
            41.6635
          ]
        ]
      },
      "properties": {
        "status": "OK",
        "vehicle_type": "AMBULANCE",
        "origin": "HOSPITAL_BASE",
        "destination": "ZONE_NORTH_RESIDENTIAL",
        "eta_minutes": 5.89,
        "distance_km": 3.926,
        "corridor_length_m": 3926.3,
        "corridor_type": "ROAD_CORRIDOR",
        "corridor_label": "lowest-risk route (model)",
        "wording": "lowest-risk route (model)",
        "uncertain_segments_count": 0,
        "max_water_depth_meters": 0.0,
        "data_age_hours": null,
        "path_nodes": [
          "HOSPITAL_BASE",
          "JUNCTION_PARAISO",
          "JUNCTION_CENTRO",
          "PUENTE_PIEDRA_SOUTH",
          "PUENTE_PIEDRA_NORTH",
          "ZONE_NORTH_RESIDENTIAL"
        ],
        "geometry_quality": "schematic_straight_lines",
        "avoided_hazards": [],
        "is_predictive_detour": false,
        "route_reliability": 0.9999,
        "outbound_reliability": 1.0,
        "edge_risks": [
          0.0,
          0.0,
          0.0,
          0.0001,
          0.0
        ],
        "planning_edge_risks": [
          0.0,
          0.0,
          0.0,
          0.0006,
          0.0001
        ],
        "max_planning_risk": 0.0006,
        "risk_warning": false,
        "advisory": "NONE",
        "risk_horizon_note": "edge_risks reflects round-trip exposure horizon; planning_edge_risks reflects 30-minute planning horizon",
        "round_trip": true,
        "eta_delta_min": 0.0,
        "counterfactual": {
          "reactive_path_nodes": [
            "HOSPITAL_BASE",
            "JUNCTION_PARAISO",
            "JUNCTION_CENTRO",
            "PUENTE_PIEDRA_SOUTH",
            "PUENTE_PIEDRA_NORTH",
            "ZONE_NORTH_RESIDENTIAL"
          ],
          "reactive_eta_min": 5.89,
          "reactive_reliability": 0.9999,
          "eta_delta_min": 0.0,
          "reliability_gain": 0.0
        },
        "departure_window_min": 35,
        "window_capped": false,
        "rainfall_mmh": 15.0,
        "blocked_edges": [],
        "depth_source": "scenario",
        "data_freshness": "UNKNOWN",
        "geometry_length_km": 3.926,
        "scenario_id": "scenario_1_baseline"
      }
    },
    {
      "type": "Feature",
      "geometry": {
        "type": "LineString",
        "coordinates": [
          [
            -0.8988,
            41.6347
          ],
          [
            -0.8872,
            41.6468
          ],
          [
            -0.8821,
            41.6575
          ],
          [
            -0.8812,
            41.6602
          ],
          [
            -0.874,
            41.6635
          ]
        ]
      },
      "properties": {
        "status": "OK",
        "vehicle_type": "AMBULANCE",
        "origin": "HOSPITAL_BASE",
        "destination": "ZONE_NORTH_RESIDENTIAL",
        "eta_minutes": 6.58,
        "distance_km": 4.385,
        "corridor_length_m": 4385.3,
        "corridor_type": "ROAD_CORRIDOR",
        "corridor_label": "lowest-risk route (model)",
        "wording": "lowest-risk route (model)",
        "uncertain_segments_count": 0,
        "max_water_depth_meters": 0.0,
        "data_age_hours": null,
        "path_nodes": [
          "HOSPITAL_BASE",
          "JUNCTION_PARAISO",
          "PUENTE_SANTIAGO_SOUTH",
          "PUENTE_SANTIAGO_NORTH",
          "ZONE_NORTH_RESIDENTIAL"
        ],
        "geometry_quality": "schematic_straight_lines",
        "avoided_hazards": [
          {
            "edge": [
              "JUNCTION_CENTRO",
              "PUENTE_PIEDRA_SOUTH"
            ],
            "name": "Centro - Puente de Piedra South",
            "reason": "PREDICTED_SUBMERSION",
            "depth_m": 0.0,
            "planning_risk": 0.6682,
            "risk": 0.6682,
            "geometry": null
          },
          {
            "edge": [
              "PUENTE_PIEDRA_SOUTH",
              "PUENTE_PIEDRA_NORTH"
            ],
            "name": "Puente de Piedra",
            "reason": "PREDICTED_SUBMERSION",
            "depth_m": 0.0,
            "planning_risk": 0.9802,
            "risk": 0.9802,
            "geometry": null
          },
          {
            "edge": [
              "PUENTE_PIEDRA_NORTH",
              "ZONE_NORTH_RESIDENTIAL"
            ],
            "name": "Puente de Piedra North - North Residential",
            "reason": "PREDICTED_SUBMERSION",
            "depth_m": 0.0,
            "planning_risk": 0.832,
            "risk": 0.832,
            "geometry": null
          }
        ],
        "is_predictive_detour": true,
        "route_reliability": 0.9983,
        "outbound_reliability": 1.0,
        "edge_risks": [
          0.0,
          0.0,
          0.001,
          0.0007
        ],
        "planning_edge_risks": [
          0.0,
          0.0006,
          0.0431,
          0.0411
        ],
        "max_planning_risk": 0.0431,
        "risk_warning": false,
        "advisory": "NONE",
        "risk_horizon_note": "edge_risks reflects round-trip exposure horizon; planning_edge_risks reflects 30-minute planning horizon",
        "round_trip": true,
        "eta_delta_min": 0.69,
        "counterfactual": {
          "reactive_path_nodes": [
            "HOSPITAL_BASE",
            "JUNCTION_PARAISO",
            "JUNCTION_CENTRO",
            "PUENTE_PIEDRA_SOUTH",
            "PUENTE_PIEDRA_NORTH",
            "ZONE_NORTH_RESIDENTIAL"
          ],
          "reactive_eta_min": 5.89,
          "reactive_reliability": 0.5913,
          "eta_delta_min": 0.69,
          "reliability_gain": 0.407
        },
        "departure_window_min": 5,
        "window_capped": false,
        "rainfall_mmh": 45.0,
        "blocked_edges": [],
        "depth_source": "scenario",
        "data_freshness": "UNKNOWN",
        "geometry_length_km": 3.929,
        "distance_basis": "road_factor applied to schematic geometry",
        "scenario_id": "scenario_2a_predictive_detour"
      }
    },
    {
      "type": "Feature",
      "geometry": {
        "type": "LineString",
        "coordinates": [
          [
            -0.8988,
            41.6347
          ],
          [
            -0.8872,
            41.6468
          ],
          [
            -0.8821,
            41.6575
          ],
          [
            -0.8812,
            41.6602
          ],
          [
            -0.874,
            41.6635
          ]
        ]
      },
      "properties": {
        "status": "OK",
        "vehicle_type": "AMBULANCE",
        "origin": "HOSPITAL_BASE",
        "destination": "ZONE_NORTH_RESIDENTIAL",
        "eta_minutes": 6.58,
        "distance_km": 4.385,
        "corridor_length_m": 4385.3,
        "corridor_type": "ROAD_CORRIDOR",
        "corridor_label": "lowest-risk route (model)",
        "wording": "lowest-risk route (model)",
        "uncertain_segments_count": 0,
        "max_water_depth_meters": 0.0,
        "data_age_hours": null,
        "path_nodes": [
          "HOSPITAL_BASE",
          "JUNCTION_PARAISO",
          "PUENTE_SANTIAGO_SOUTH",
          "PUENTE_SANTIAGO_NORTH",
          "ZONE_NORTH_RESIDENTIAL"
        ],
        "geometry_quality": "schematic_straight_lines",
        "avoided_hazards": [
          {
            "edge": [
              "PUENTE_PIEDRA_SOUTH",
              "PUENTE_PIEDRA_NORTH"
            ],
            "name": "Puente de Piedra",
            "reason": "SUBMERGED",
            "depth_m": 0.8,
            "planning_risk": 0.0006,
            "risk": 0.0006,
            "geometry": null
          }
        ],
        "is_predictive_detour": false,
        "route_reliability": 1.0,
        "outbound_reliability": 1.0,
        "edge_risks": [
          0.0,
          0.0,
          0.0,
          0.0
        ],
        "planning_edge_risks": [
          0.0,
          0.0,
          0.0,
          0.0
        ],
        "max_planning_risk": 0.0,
        "risk_warning": false,
        "advisory": "NONE",
        "risk_horizon_note": "edge_risks reflects round-trip exposure horizon; planning_edge_risks reflects 30-minute planning horizon",
        "round_trip": true,
        "eta_delta_min": 0.0,
        "counterfactual": {
          "reactive_path_nodes": [
            "HOSPITAL_BASE",
            "JUNCTION_PARAISO",
            "PUENTE_SANTIAGO_SOUTH",
            "PUENTE_SANTIAGO_NORTH",
            "ZONE_NORTH_RESIDENTIAL"
          ],
          "reactive_eta_min": 6.58,
          "reactive_reliability": 1.0,
          "eta_delta_min": 0.0,
          "reliability_gain": 0.0
        },
        "departure_window_min": 65,
        "window_capped": false,